{
  "schema_version": 2,
  "type": "shift_right_click",
  "target": {
    "kind": "block",
    "match": "minecraft:furnace",
    "state": { "whitelist": { "lit": "true" } }
  },
  "rewards": {
    "weighted": [
      { "match": "minecraft:charcoal", "weight": 25, "count": { "min": 1, "max": 3 } },
      { "match": "minecraft:air", "weight": 75 }
    ]
  }
}
