{
  "schema_version": 2,
  "type": "shift_right_click",
  "target": { "kind": "block", "match": "minecraft:hay_block" },
  "rewards": {
    "weighted": [
      { "match": "minecraft:wheat", "weight": 60, "count": { "min": 1, "max": 3 } },
      { "match": "minecraft:wheat_seeds", "weight": 40, "count": { "min": 1, "max": 2 } }
    ]
  },
  "conditions": {
    "time": "day",
    "weather": ["clear"]
  }
}
