{
  "schema_version": 2,
  "type": "right_click",

  "costs": {
    "damage": { "chance": 1.0, "amount": 1 },
    "hunger": { "chance": 0.5, "amount": { "min": 2, "max": 8 } }
  },

  "hand": {
    "hand": "off",
    "match": "#minecraft:hoes",
    "consume": { "mode": "durability" },
    "nbt": {
      "whitelist": "{Damage:{RangeTag:[0,500]},Enchantments:[{lvl:{RangeTag:[2s,7s]},id:\"minecraft:unbreaking\"},{lvl:3s,id:\"minecraft:fortune\"}]}",
      "blacklist": "{Enchantments:[{lvl:1s,id:\"minecraft:mending\"}]}"
    }
  },

  "rewards": {
    "weighted": [
      { "match": "#c:seeds", "weight": 10, "count": { "min": 3, "max": 10 } },
      { "match": "#c:nuggets", "weight": 1, "count": 1 },
      { "match": "minecraft:air", "weight": 1 }
    ]
  }
}
