{
  "schema_version": 2,
  "type": "right_click",
  "hand": {
    "hand": "off",
    "match": "#minecraft:hoes",
    "consume": { "mode": "durability" }
  },
  "target": { "kind": "air" },
  "rewards": {
    "weighted": [
      { "match": "#c:seeds", "weight": 10, "count": { "min": 3, "max": 10 } },
      { "match": "minecraft:air", "weight": 90 }
    ]
  }
}
