{
  "schema_version": 2,
  "type": "shift_left_click",
  "hand": {
    "hand": "main",
    "match": "minecraft:stone_pickaxe",
    "consume": {
      "mode": "durability",
      "count": 1
    }
  },
  "target": {
    "kind": "block",
    "match": "minecraft:andesite"
  },
  "rewards": {
    "weighted": [
      {
        "match": "minecraft:flint",
        "weight": 1
      },
      {
        "match": "minecraft:clay_ball",
        "weight": 2
      },
      {
        "match": "minecraft:coal",
        "weight": 3
      },
      {
        "match": "minecraft:raw_copper",
        "weight": 4
      },
      {
        "match": "minecraft:raw_iron",
        "weight": 5
      },
      {
        "match": "minecraft:raw_gold",
        "weight": 1
      },
      {
        "match": "minecraft:lapis_lazuli",
        "weight": 2
      },
      {
        "match": "minecraft:redstone",
        "weight": 3
      },
      {
        "match": "minecraft:quartz",
        "weight": 4
      }
    ]
  }
}
