{
  "schema_version": 2,
  "type": "left_click",
  "target": { "kind": "block", "match": ["minecraft:red_sand", "minecraft:sand"] },
  "rewards": {
    "rolls": 2,
    "weighted": [
      { "match": ["minecraft:gold_nugget", "minecraft:iron_nugget"], "weight": 5, "count": 1 },
      { "match": "minecraft:air", "weight": 95 }
    ]
  }
}
