{
  "schema_version": 2,
  "type": "left_click",
  "hand": { "hand": "main", "match": "minecraft:feather" },
  "target": { "kind": "air" },
  "rewards": {
    "weighted": [
      { "match": "minecraft:phantom_membrane", "weight": 5, "count": 1 },
      { "match": "minecraft:air", "weight": 95 }
    ]
  },
  "particles": "minecraft:white_wool"
}
